Title,Media URL,Pinterest board,Thumbnail,Description,Link,Publish date,Keywords
Ambrane Fast Charging Type C Cable | Durable Braided USB-C 1.5m Cord,https://images-eu.ssl-images-amazon.com/images/I/61W8xeZTwxL._AC_UL1000_.jpg,Amazon India Deals,,"Get lightning-fast 3A charging with this Ambrane Type C cable. Its unbreakable braided design ensures superior durability and a tangle-free experience for your smartphone. Enjoy reliable, high-speed power delivery for all your USB-C devices. #TypeCCable #FastCharging #DurableCable #USBC #AndroidCharger",https://www.amazon.in/dp/B098NS6PVG?tag=dhamakade0455-21,,"TypeCCable, FastCharging, DurableCable, USBC, AndroidCharger"
"Safari Omega Spacious Laptop Backpack for College, Travel & Daily Use with Raincover",https://images-eu.ssl-images-amazon.com/images/I/71maWXZscfL._AC_UL1000_.jpg,Amazon India Deals,,"Stay organized on the go with the Safari Omega spacious laptop backpack, designed for students and travelers. This large capacity backpack includes a dedicated laptop sleeve and a convenient raincover, making it perfect for college, work, or weekend trips. #LaptopBackpack #CollegeBag #TravelBackpack #SafariOmega #Raincover",https://www.amazon.in/dp/B097JJ2CK6?tag=dhamakade0455-21,,"LaptopBackpack, CollegeBag, TravelBackpack, SafariOmega, Raincover"
"American Tourister Valex 28L Backpack | 17"" Laptop Bag | 2 Compartment Travel",https://images-eu.ssl-images-amazon.com/images/I/51yfw2JIxwL._AC_UL1000_.jpg,Amazon India Deals,,"Discover the American Tourister Valex 28L backpack, designed for modern commuters and students. This spacious backpack offers dedicated protection for your 17-inch laptop and features two main compartments to keep your essentials organized for daily use or travel. A durable everyday bag for all your gear. #AmericanTourister #LaptopBackpack #TravelBag #WorkBackpack #StudentBackpack",https://www.amazon.in/dp/B0BTD4S4XF?tag=dhamakade0455-21,,"AmericanTourister, LaptopBackpack, TravelBag, WorkBackpack, StudentBackpack"
Red Tape Men's Pull On Clogs | Comfortable & Easy Slip-On Footwear,https://images-eu.ssl-images-amazon.com/images/I/61RMzIzWHEL._AC_UL1000_.jpg,Amazon India Deals,,"Discover the ultimate comfort with Red Tape Men's Pull On Clogs. These versatile slip-on shoes are perfect for everyday wear, casual outings, or even gardening, offering a durable design and easy on-and-off convenience. #MensClogs #SlipOnShoes #RedTapeFootwear #ComfortShoes #CasualFootwear",https://www.amazon.in/dp/B0CSWN4TCK?tag=dhamakade0455-21,,"MensClogs, SlipOnShoes, RedTapeFootwear, ComfortShoes, CasualFootwear"
OnePlus N6 Fresh Mint Phone | 6GB RAM | 128GB Storage | 8000mAh Battery,https://images-eu.ssl-images-amazon.com/images/I/61d03Bx0AjL._AC_UL1000_.jpg,Amazon India Deals,,"Discover the new OnePlus N6 Fresh Mint smartphone, equipped with a segment-leading 8000mAh battery for ultimate endurance. Experience seamless multitasking with 6GB RAM and ample space for all your memories on the 128GB internal storage. This powerful Android device is perfect for anyone seeking a reliable phone with exceptional battery life. #OnePlusN6 #FreshMintPhone #LongBatteryLife #AndroidSmartphone #NewPhone",https://www.amazon.in/dp/B0H3LGB59B?tag=dhamakade0455-21,,"OnePlusN6, FreshMintPhone, LongBatteryLife, AndroidSmartphone, NewPhone"
Portronics Conch Theta C Type C Wired Earphones | In-Ear Headphones with HD Mic,https://images-eu.ssl-images-amazon.com/images/I/51GGwjwSr0L._AC_UL1000_.jpg,Amazon India Deals,,"Discover the Portronics Conch Theta C Type C wired earphones, perfect for clear calls and immersive music. Enjoy crisp HD audio and comfortable in-ear design, compatible with your Type C enabled smartphones and devices. Get reliable sound quality for everyday use. #TypeCEarphones #WiredHeadphones #InEarEarbuds #Portronics #HDAudio",https://www.amazon.in/dp/B0DDHM6D3L?tag=dhamakade0455-21,,"TypeCEarphones, WiredHeadphones, InEarEarbuds, Portronics, HDAudio"
Zebronics Blanc Slim Wireless Mouse | Rechargeable Battery & Dual Mode BT 2.4GHz,https://images-eu.ssl-images-amazon.com/images/I/51vMo-pHZ5L._AC_UL1000_.jpg,Amazon India Deals,,"Enhance your productivity with the Zebronics Blanc Slim Wireless Mouse. Enjoy versatile dual mode Bluetooth and 2.4GHz connectivity for your laptop or desktop, powered by a convenient rechargeable battery. No more disposable batteries needed! #WirelessMouse #RechargeableMouse #BluetoothMouse #LaptopAccessories #Zebronics",https://www.amazon.in/dp/B0CQRNWJM2?tag=dhamakade0455-21,,"WirelessMouse, RechargeableMouse, BluetoothMouse, LaptopAccessories, Zebronics"
OnePlus N6 Midnight Green Smartphone | 6GB RAM + 128GB Storage | 8000mAh Battery,https://images-eu.ssl-images-amazon.com/images/I/61f5ZCuSD6L._AC_UL1000_.jpg,Amazon India Deals,,"Discover the new OnePlus N6 in stunning Midnight Green, a powerful smartphone designed for exceptional performance and longevity. Enjoy seamless multitasking and ample storage with 6GB RAM and 128GB, plus experience uninterrupted usage thanks to its segment's biggest 8000mAh battery. #OnePlusN6 #MidnightGreen #BigBatteryPhone #SmartphoneTech #NewPhone",https://www.amazon.in/dp/B0H3LKPC2K?tag=dhamakade0455-21,,"OnePlusN6, MidnightGreen, BigBatteryPhone, SmartphoneTech, NewPhone"
OnePlus Nord Buds 3r True Wireless Earbuds for Long Playback & Clear Calls,https://images-eu.ssl-images-amazon.com/images/I/51nBTTG3hNL._AC_UL1000_.jpg,Amazon India Deals,,"Discover the OnePlus Nord Buds 3r TWS Earbuds, engineered for an exceptional audio experience. Enjoy up to 54 hours of total playback, perfect for all-day listening, and crystal-clear calls thanks to 2-mic noise reduction. These true wireless earbuds deliver immersive sound quality, making them ideal for music lovers and busy professionals alike. #OnePlusNordBuds3r #TWSearbuds #WirelessEarphones #LongBatteryLife #ClearCalls",https://www.amazon.in/dp/B0FMDL81GS?tag=dhamakade0455-21,,"OnePlusNordBuds3r, TWSearbuds, WirelessEarphones, LongBatteryLife, ClearCalls"
Samsung Galaxy S25 Ultra 5G AI Smartphone - Titanium Silverblue 256GB,https://images-eu.ssl-images-amazon.com/images/I/71tl8pu4fKL._AC_UL1000_.jpg,Amazon India Deals,,"Discover the ultimate Samsung Galaxy S25 Ultra 5G AI smartphone. Experience unparalleled performance with 12GB RAM, ample 256GB storage, and cutting-edge AI features in a stunning Titanium Silverblue finish. Perfect for gaming, photography, and staying connected on the go. #SamsungGalaxyS25Ultra #AISmartphone #5GPhone #NewSmartphone #TechGadgets",https://www.amazon.in/dp/B0DSKNKCYX?tag=dhamakade0455-21,,"SamsungGalaxyS25Ultra, AISmartphone, 5GPhone, NewSmartphone, TechGadgets"
Easy LPG Cylinder Booking Online,https://images-eu.ssl-images-amazon.com/images/I/415aawinNhL._AC_UL1000_.jpg,Amazon India Deals,,Skip the hassle of physical bookings! Get your LPG cylinder delivered quickly and conveniently. Find trusted providers and book your next gas refill with just a few clicks. #LPGbooking #GasCylinder #HomeDelivery #OnlineBooking,https://www.amazon.in/dp/B07QP9PTZP?tag=dhamakade0455-21,,"LPGbooking, GasCylinder, HomeDelivery, OnlineBooking"
"Amazon Brand Presto! Medium Garbage Bags | 180 Count Trash Bags, 6 Rolls",https://images-eu.ssl-images-amazon.com/images/I/61fn1xtHO4L._AC_UL1000_.jpg,Amazon India Deals,,"Get reliable waste disposal with Amazon Brand Presto! medium garbage bags. This bulk pack includes 180 count, perfect for everyday kitchen use and fitting standard medium trash cans. Keep your home clean and tidy with these strong, convenient trash bags. #GarbageBags #TrashBags #MediumTrashBags #KitchenEssentials #HomeOrganization",https://www.amazon.in/dp/B0821PN8L4?tag=dhamakade0455-21,,"GarbageBags, TrashBags, MediumTrashBags, KitchenEssentials, HomeOrganization"
LiMETRO STEEL Stainless Steel Foldable Double Rack Clothes Drying Stand,https://images-eu.ssl-images-amazon.com/images/I/81zi4U9ZxgL._AC_UL1000_.jpg,Amazon India Deals,,"Maximize your laundry drying space with this durable stainless steel foldable clothes dryer stand, perfect for indoor or outdoor use. Its double rack design provides ample room for clothes, making it an essential space-saving laundry solution for homes and apartments. #ClothesDryingRack #LaundryRoom #SpaceSaving #HomeOrganization #StainlessSteel",https://www.amazon.in/dp/B07PPBD529?tag=dhamakade0455-21,,"ClothesDryingRack, LaundryRoom, SpaceSaving, HomeOrganization, StainlessSteel"
Sandalwood Saffron Bath Soap for Glowing Skin | Natural Magic Soaps Pack,https://images-eu.ssl-images-amazon.com/images/I/718F+0RgtfL._AC_UL1000_.jpg,Amazon India Deals,,"Experience a luxurious bath with our Sandalwood and Saffron Magic Soaps. Crafted with natural ingredients for soft, glowing skin, these paraben-free soaps transform your daily bath routine into a pampering ritual. Indulge in the aromatic fragrance and feel the difference on your skin. #SandalwoodSoap #SaffronSoap #NaturalSoap #BathTime #Skincare",https://www.amazon.in/dp/B09S6M7JQJ?tag=dhamakade0455-21,,"SandalwoodSoap, SaffronSoap, NaturalSoap, BathTime, Skincare"
Wall Mounted Pull Up Bar for Home Workouts - Slovic Fitness for Kids & Adults,https://images-eu.ssl-images-amazon.com/images/I/71+J9cM+N-L._AC_UL1000_.jpg,Amazon India Deals,,"Transform your home into a powerful workout space with the Slovic wall mounted pull up bar. Perfect for daily upper body exercises, strength training, and core workouts for the whole family. Get fit together! #PullUpBar #HomeGym #FitnessEquipment #StrengthTraining #WorkoutAtHome",https://www.amazon.in/dp/B0B6NSDR2H?tag=dhamakade0455-21,,"PullUpBar, HomeGym, FitnessEquipment, StrengthTraining, WorkoutAtHome"
Lifelong PVC Hex Dumbbells 5kg Pair - Black Home Gym Weights for Strength Training,https://images-eu.ssl-images-amazon.com/images/I/710SxepIfiL._AC_UL1000_.jpg,Amazon India Deals,,"Elevate your home workouts with these durable Lifelong 5kg PVC hex dumbbells, perfect for strength training and muscle building. The black PVC coating protects floors and provides a non-slip grip, while the hexagonal shape prevents rolling. Essential fitness equipment for your personal gym setup. #HomeGym #Dumbbells #StrengthTraining #FitnessEquipment",https://www.amazon.in/dp/B09W5PSTBP?tag=dhamakade0455-21,,"HomeGym, Dumbbells, StrengthTraining, FitnessEquipment"
Lifelong Adjustable Doorway Pull Up Bar for Home Workouts | Kids & Adults,https://images-eu.ssl-images-amazon.com/images/I/61wiwhVcZJL._AC_UL1000_.jpg,Amazon India Deals,,"Transform your home into a gym with this adjustable doorway pull up bar. Perfect for kids and adults, this easy-to-install fitness bar requires no drilling, making it ideal for upper body workouts and strength training at home. Get your portable exercise bar today! #PullUpBar #HomeWorkout #FitnessEquipment #StrengthTraining #NoDrill",https://www.amazon.in/dp/B0GWN14N9F?tag=dhamakade0455-21,,"PullUpBar, HomeWorkout, FitnessEquipment, StrengthTraining, NoDrill"
Simple Kind To Skin Refreshing Facial Wash | Gentle Soap-Free Cleanser for All Skin,https://images-eu.ssl-images-amazon.com/images/I/51wqZYWGr+L._AC_UL1000_.jpg,Amazon India Deals,,"Discover Simple Kind To Skin Refreshing Facial Wash, your go-to for a gentle, effective cleanse. This 100% soap-free formula removes impurities without drying, leaving your skin feeling fresh and hydrated. Perfect for daily use and all skin types, including sensitive skin, it's an essential for your skincare routine. #SimpleSkincare #FacialWash #GentleCleanser #SensitiveSkin #SoapFree",https://www.amazon.in/dp/B000LQUA6M?tag=dhamakade0455-21,,"SimpleSkincare, FacialWash, GentleCleanser, SensitiveSkin, SoapFree"
Cetaphil Gentle Hydrating Face Wash for Sensitive Dry Skin - Paraben & Sulphate Free,https://images-eu.ssl-images-amazon.com/images/I/61Ti2uv6V3L._AC_UL1000_.jpg,Amazon India Deals,,"Experience the Cetaphil Gentle Skin Hydrating Face Wash for sensitive and dry skin. This paraben-free, sulphate-free cleanser gently removes impurities, preserving your skin's natural moisture barrier. Enjoy a soft, refreshed, and healthy complexion daily. #Cetaphil #GentleCleanser #SensitiveSkin #DrySkinCare #HydratingFaceWash",https://www.amazon.in/dp/B01CCGW4OE?tag=dhamakade0455-21,,"Cetaphil, GentleCleanser, SensitiveSkin, DrySkinCare, HydratingFaceWash"
Redmi A7 Pro 5G Mist Blue - Fastest Processor Budget Android Phone,https://images-eu.ssl-images-amazon.com/images/I/71eQsL8sqcL._AC_UL1000_.jpg,Amazon India Deals,,"Upgrade your mobile experience with the new Redmi A7 Pro 5G in beautiful Mist Blue. Featuring 4GB RAM, 64GB storage, and the segment's fastest processor, this budget Android phone delivers smooth gaming and multitasking. It is the perfect affordable 5G smartphone for everyday use. #RedmiA7Pro5G #BudgetSmartphone #5GPhone #MistBlue",https://www.amazon.in/dp/B0GS5Y7QBF?tag=dhamakade0455-21,,"RedmiA7Pro5G, BudgetSmartphone, 5GPhone, MistBlue"
Portable Adjustable Laptop Stand for Desk | Ergonomic Aluminum Tabletop Riser,https://images-eu.ssl-images-amazon.com/images/I/61kBmC8NfGL._AC_UL1000_.jpg,Amazon India Deals,,"Upgrade your home office or remote work setup with this ergonomic aluminum laptop stand. Its 6 adjustable angles help correct your posture and reduce neck strain, making it a perfect desk accessory for students and professionals. The foldable, lightweight design makes it a portable laptop holder for travel or small spaces, fitting various devices and tablets. #laptopholder #desksetup #homeofficeideas #ergonomicdesign #workfromhome",https://www.amazon.in/dp/B08LHTJTBB?tag=dhamakade0455-21,,"laptopholder, desksetup, homeofficeideas, ergonomicdesign, workfromhome"
Best De-Tan Face Wash for Sun Tan Removal and Glowing Skin | Ghar Soaps,https://images-eu.ssl-images-amazon.com/images/I/71x-JgwRslL._AC_UL1000_.jpg,Amazon India Deals,,"Say goodbye to stubborn sun tan with the Ghar Soaps De-Tan Face Wash. Specially formulated to help reduce tanning, brighten your skin tone, and restore your natural glow. This gentle cleanser is the perfect addition to your daily skincare routine for clear, radiant skin. #detanfacewash #glowingskin #skincareroutine #tanremoval",https://www.amazon.in/dp/B0GYCT961V?tag=dhamakade0455-21,,"detanfacewash, glowingskin, skincareroutine, tanremoval"
Boldfit Adjustable Pull Up Bar for Home Workout - No Screw Doorway Chin Up,https://images-eu.ssl-images-amazon.com/images/I/71WQF5nGb9L._AC_UL1000_.jpg,Amazon India Deals,,"Transform your home workout space with this adjustable pull up bar from Boldfit. Perfect for strength training and bodyweight exercises, it installs easily in any doorway without screws. Get your upper body workout in anytime with this convenient home gym essential. #PullUpBar #HomeWorkout #FitnessEquipment #ChinUpBar #NoScrewPullUpBar",https://www.amazon.in/dp/B0DCJYS6KG?tag=dhamakade0455-21,,"PullUpBar, HomeWorkout, FitnessEquipment, ChinUpBar, NoScrewPullUpBar"
Samsung 25W USB Type-C Travel Adaptor for Google Pixel & Android Phones,https://images-eu.ssl-images-amazon.com/images/I/512UVkoMMEL._AC_UL1000_.jpg,Amazon India Deals,,"Get the genuine Samsung 25W USB-C power adapter for your Google Pixel. This compact wall charger ensures super fast charging for your Android smartphone, perfect as a portable travel accessory. A must-have for quick power boosts on the go. #SamsungOriginal #PixelCharger #25WCharger #USBCTypeC #TravelAdapter",https://www.amazon.in/dp/B0D2R2MXXJ?tag=dhamakade0455-21,,"SamsungOriginal, PixelCharger, 25WCharger, USBCTypeC, TravelAdapter"
ATOM ALISTON K1 Digital Kitchen Weighing Scale 10kg - Accurate Food Scale,https://images-eu.ssl-images-amazon.com/images/I/71775fRr+gL._AC_UL1000_.jpg,Amazon India Deals,,"Achieve perfect baking and cooking results with the ATOM ALISTON K1 digital kitchen scale. This electronic weighing scale has a 10 kg capacity for all your ingredients, making meal prep and portion control simple with precise measurements. #KitchenScale #DigitalScale #FoodScale #BakingTools #MealPrep",https://www.amazon.in/dp/B083C6XMKQ?tag=dhamakade0455-21,,"KitchenScale, DigitalScale, FoodScale, BakingTools, MealPrep"
Women's Orthopedic Platform Slippers | Ultra-Cushioned Comfort for Foot Health,https://images-eu.ssl-images-amazon.com/images/I/71HJPMhPOTL._AC_UL1000_.jpg,Amazon India Deals,,"Step into ultimate comfort with these ultra-cushioned women's orthopedic platform slippers. Designed for superior arch support and foot pain relief, they are perfect for everyday indoor and outdoor wear. Enjoy plush softness with every step. #OrthopedicSlippers #WomensSlippers #FootComfort #ArchSupport",https://www.amazon.in/dp/B0H74HSXGK?tag=dhamakade0455-21,,"OrthopedicSlippers, WomensSlippers, FootComfort, ArchSupport"
Diabetic Orthopedic Sandals for Women | Pregnancy & Flat Foot Comfort,https://images-eu.ssl-images-amazon.com/images/I/61U3mvWM0XL._AC_UL1000_.jpg,Amazon India Deals,,"Discover the ultimate comfort with our orthopedic sandals, perfect for diabetic foot care and pregnancy support. Enjoy super soft cushioning and crucial arch support, making these flat sandals ideal for managing discomfort from flat feet and providing overall pain relief. #DiabeticSandals #OrthopedicFootwear #PregnancyComfort #FlatFootSupport #ComfortSandals",https://www.amazon.in/dp/B074CZZQ8V?tag=dhamakade0455-21,,"DiabeticSandals, OrthopedicFootwear, PregnancyComfort, FlatFootSupport, ComfortSandals"
Frido Cloud Comfort Slippers for Women & Men | Arch Support House Shoes,https://images-eu.ssl-images-amazon.com/images/I/71C+XPnk0GL._AC_UL1000_.jpg,Amazon India Deals,,"Experience ultimate relaxation with Frido Cloud Comfort Slippers. These plush indoor house shoes for women and men offer superior arch support, providing comfort and relief from foot pain. Perfect for cozy relaxation after a long day. #CloudSlippers #ArchSupportSlippers #ComfortFootwear #HouseSlippers #FridoSlippers",https://www.amazon.in/dp/B0FR9GT4LM?tag=dhamakade0455-21,,"CloudSlippers, ArchSupportSlippers, ComfortFootwear, HouseSlippers, FridoSlippers"
Scalpe Pro Daily Anti-Dandruff Shampoo: Removes & Prevents Dandruff,https://images-eu.ssl-images-amazon.com/images/I/51CAf22M1SL._AC_UL1000_.jpg,Amazon India Deals,,"Looking for an effective anti-dandruff shampoo you can use daily? Scalpe Pro is designed to remove dandruff from its source and prevent future build-up, ensuring a clean, healthy scalp and beautiful, flake-free hair with every wash. Perfect for ongoing scalp maintenance. #antidandruff #scalphealth #haircare #dandruffrelief #dailyshampoo",https://www.amazon.in/dp/B0BLM3Q44F?tag=dhamakade0455-21,,"antidandruff, scalphealth, haircare, dandruffrelief, dailyshampoo"
OnePlus Nord 6 Fresh Mint - Snapdragon 8s Gen 4 - 8GB RAM 256GB Storage,https://images-eu.ssl-images-amazon.com/images/I/61F1NWYtCKL._AC_UL1000_.jpg,Amazon India Deals,,"Experience the groundbreaking OnePlus Nord 6 smartphone, powered by the segment's first Snapdragon 8s Gen 4 for ultimate speed. This Fresh Mint device boasts 8GB RAM and 256GB storage, perfect for seamless multitasking and ample space. #OnePlusNord6 #Snapdragon8sGen4 #FreshMintPhone #NewSmartphone #AndroidPhone",https://www.amazon.in/dp/B0GRBBPBGQ?tag=dhamakade0455-21,,"OnePlusNord6, Snapdragon8sGen4, FreshMintPhone, NewSmartphone, AndroidPhone"
OnePlus Nord CE6 Pitch Black | 8GB RAM 128GB Storage | Snapdragon 7s Gen 4 Phone,https://images-eu.ssl-images-amazon.com/images/I/61Di24QT6GL._AC_UL1000_.jpg,Amazon India Deals,,"Experience next-level performance with the OnePlus Nord CE6 Pitch Black smartphone. Featuring a powerful Snapdragon 7s Gen 4 processor, 8GB RAM, and 128GB storage, it’s designed for seamless multitasking and fast operation. Get your new Android mobile today. #OnePlusNordCE6 #SnapdragonPhone #NewAndroidPhone #MobileTech #OnePlus",https://www.amazon.in/dp/B0GWLHVJRH?tag=dhamakade0455-21,,"OnePlusNordCE6, SnapdragonPhone, NewAndroidPhone, MobileTech, OnePlus"
DOCTOR HEALTH Women's Orthopedic Soft Platform Slippers | Ultra-Cushioned Comfort,https://images-eu.ssl-images-amazon.com/images/I/61lHUI-Df2L._AC_UL1000_.jpg,Amazon India Deals,,"Experience ultimate comfort with these super soft women's orthopedic slippers, perfect for all-day wear around the house. Featuring a cushioned platform and excellent arch support, these indoor house shoes offer relief for tired feet and everyday foot pain. Treat yourself or a loved one to luxurious comfort. #OrthopedicSlippers #WomensSlippers #ComfortSlippers #ArchSupport #HouseShoes",https://www.amazon.in/dp/B0G5L5JKYX?tag=dhamakade0455-21,,"OrthopedicSlippers, WomensSlippers, ComfortSlippers, ArchSupport, HouseShoes"
Ambrane Unbreakable 60W Fast Charging Braided Type C to Type C Cable 1.5M,https://images-eu.ssl-images-amazon.com/images/I/71MhtZF5NWL._AC_UL1000_.jpg,Amazon India Deals,,"Experience lightning-fast charging with the Ambrane Unbreakable 60W Type C to Type C cable. Its super durable braided design ensures a long-lasting, tangle-free experience, perfect for high-speed data transfer and charging your smartphones, tablets, and laptops reliably. Get your strong USB-C charger cable today! #FastChargingCable #TypeCCable #USBCable #DurableCable #Ambrane",https://www.amazon.in/dp/B082LSVT4B?tag=dhamakade0455-21,,"FastChargingCable, TypeCCable, USBCable, DurableCable, Ambrane"
Fresh Assorted Button Roses | Miniature Roses for DIY Crafts and Home Decor,https://images-eu.ssl-images-amazon.com/images/I/61tZVx+LpKL._AC_UL1000_.jpg,Amazon India Deals,,"Enhance your space with these fresh assorted button roses, perfect for DIY crafts, home decor, and table arrangements. These vibrant miniature flowers are ideal for creative floral designs and festive decorations. Order fresh loose roses online for your next event. #buttonroses #freshflowers #diycrafts #homedecor #floraldecor",https://www.amazon.in/dp/B0FQ5JVLL8?tag=dhamakade0455-21,,"buttonroses, freshflowers, diycrafts, homedecor, floraldecor"
Comfortable Orthopedic Diabetic Slippers Extra Soft Pregnancy Flip Flops,https://images-eu.ssl-images-amazon.com/images/I/61U3mvWM0XL._AC_UL1000_.jpg,Amazon India Deals,,"Experience ultimate relief with these extra soft orthopedic flip flops designed for sensitive feet. Perfect for pregnancy foot pain, diabetic care, or daily comfort, these slippers provide the gentle support you need. Step into pain-free comfort today. #orthopedicslippers #diabeticshoes #pregnancycomfort #supportivesandals",https://www.amazon.in/dp/B09D8BQM7C?tag=dhamakade0455-21,,"orthopedicslippers, diabeticshoes, pregnancycomfort, supportivesandals"
Orthopedic Slippers for Women | Extra Soft Diabetic & Pregnancy Shoes,https://images-eu.ssl-images-amazon.com/images/I/61FYkcz1cYL._AC_UL1000_.jpg,Amazon India Deals,,"Find ultimate foot pain relief with these comfortable orthopedic slippers for women. Perfect for pregnancy swelling, diabetic foot care, or everyday indoor wear, these extra soft house shoes offer non-slip safety and arch support. #orthopedicslippers #diabeticslippers #pregnancycomfort #houseshoes",https://www.amazon.in/dp/B0BYTC95RD?tag=dhamakade0455-21,,"orthopedicslippers, diabeticslippers, pregnancycomfort, houseshoes"
Simple Kind to Skin Refreshing Facial Wash | Gentle Soap-Free Cleanser,https://images-eu.ssl-images-amazon.com/images/I/51FQerCM8yL._AC_UL1000_.jpg,Amazon India Deals,,"Discover the Simple Kind to Skin Refreshing Facial Wash, your go-to gentle daily cleanser. This 100% soap-free formula effectively removes dirt, oil, and impurities without stripping natural moisture, making it perfect for sensitive skin and everyday use. Achieve clean, fresh skin with this non-irritating face wash. #SimpleSkincare #FacialWash #GentleCleanser #SensitiveSkin #SoapFree",https://www.amazon.in/dp/B0CKF48RRR?tag=dhamakade0455-21,,"SimpleSkincare, FacialWash, GentleCleanser, SensitiveSkin, SoapFree"
OnePlus N6 Midnight Green Phone | 128GB Storage | Long-Lasting 8000mAh Battery,https://images-eu.ssl-images-amazon.com/images/I/61f5ZCuSD6L._AC_UL1000_.jpg,Amazon India Deals,,"Discover the OnePlus N6 in stunning Midnight Green, a powerful smartphone with a massive 8000mAh battery for extended usage. Enjoy seamless multitasking with 4GB RAM and ample space for all your apps and photos on the 128GB internal storage. Perfect for users needing a reliable, long-lasting mobile phone. #OnePlusN6 #AndroidPhone #LongBatteryLifePhone #MidnightGreen #Smartphone",https://www.amazon.in/dp/B0H3LB843J?tag=dhamakade0455-21,,"OnePlusN6, AndroidPhone, LongBatteryLifePhone, MidnightGreen, Smartphone"
OnePlus Nord CE6 Lite Vivid Mint: Fast Dimensity 740 | 6GB RAM + 128GB Storage,https://images-eu.ssl-images-amazon.com/images/I/61bbly9wcKL._AC_UL1000_.jpg,Amazon India Deals,,Discover the new OnePlus Nord CE6 Lite in stunning Vivid Mint. Enjoy lightning-fast performance for gaming and multitasking with the Dimensity 740 processor and generous 6GB RAM + 128GB storage. This sleek Android smartphone is perfect for everyday use and more. #OnePlusNordCE6Lite #VividMintPhone #FastSmartphone #AndroidTech,https://www.amazon.in/dp/B0GVYGX4JX?tag=dhamakade0455-21,,"OnePlusNordCE6Lite, VividMintPhone, FastSmartphone, AndroidTech"
Dyazo Water Resistant Laptop Sleeve with Handle | Protective Laptop Case Cover,https://images-eu.ssl-images-amazon.com/images/I/81rRMwFG0+L._AC_UL1000_.jpg,Amazon India Deals,,"Keep your laptop safe and dry with this water-resistant laptop sleeve featuring a comfortable handle for easy carrying. This durable laptop case provides essential protection against spills and bumps, perfect for daily commute, travel, or school. #LaptopSleeve #LaptopCase #WaterResistant #LaptopProtection #TechAccessories",https://www.amazon.in/dp/B09BFV96TS?tag=dhamakade0455-21,,"LaptopSleeve, LaptopCase, WaterResistant, LaptopProtection, TechAccessories"
